ID,title,types,premium,lon,lat,metro_cat,metro,tel,rating,ratingCount,reviewCount,address,timing,description,site
58e18ac840c0886f708bb247,Парикмахерская на проспекте Мельникова в Химках,beauty,False,37.408395,55.902653,Планерная,Планерная,79255660448,0.0,0,0,"Химки,  Мельникова проспект,  12",ежедневно: 10:00 - 21:00,"       Парикмахерская на проспекте Мельникова в Химках радует своих гостей красивыми и оригинальными стрижками от настоящих профи. Здесь ваши волосы ждет настоящее преображение, ведь специализированный уход за локонами — это основная функция мастеров парикмахерской.   У мастера маникюра вам смогут сделать красивый маникюр.     Парикмахерская находится рядом со станцией метро Планерная, по адресу Химки, Мельникова проспект, 12. Часы работы с ежедневно: 10:00 - 21:00.     ",-
58e18ad240c0886f708bb2bd,Ногтевая студия Ля Маникюр,beauty,False,37.448721,55.892286,Планерная,Планерная,79090200020,0.0,0,0,"Химки,  Московская,  5",ежедневно: 09:00 - 21:00,"       В шумной городской суете иногда нужно баловать себя приятными услугами. Посетив ногтевую студию Ля Маникюр, вы сможете с пользой для себя провести время. Салон предлагает самые популярные услуги от мастеров с большим стажем работы.   У мастера маникюра вам смогут сделать красивый маникюр.     Ногтевая студия находится по адресу Химки, Московская, 5. Часы работы с ежедневно: 09:00 - 21:00.     ",-
57a9c90340c088e74d8b5328,"Парикмахерская Школа Эйдетики, НОУ",beauty,False,37.443354,55.857673999999996,"Планерная,Сходненская",Планерная,74954950501,0.0,0,0,"Москва,  Фомичёвой,  12 к1, 1 этаж",пн-сб: 10:00—21:00; вс: 10:00—20:00,"       Парикмахерская Школа Эйдетики, НОУ радует своих посетителей красивыми и оригинальными стрижками от настоящих профи. Здесь ваши волосы ждет настоящее преображение, ведь специализированный уход за локонами — это основная функция мастеров парикмахерской.       Парикмахерская находится рядом со станцией метро Планерная, по адресу Фомичёвой, 12 к1. Часы работы с пн-сб: 10:00 - 21:00; вс: 10:00 - 20:00.     ",-
54e5424cef9f60243d8b4576,Парикмахерская Алана,beauty,False,37.446853000000004,55.887165,Планерная,Планерная,79096741414,0.0,0,0,"Химки,  Калинина,  9, 1 этаж",ежедневно: 10:00 - 21:00,"       Парикмахерская Алана радует своих гостей красивыми и оригинальными стрижками от специалистов с большим опытом. Здесь ваши волосы ждет настоящее преображение, ведь специализированный уход за локонами — это основная функция мастеров парикмахерской.   В кабинете парикмахера вы сможете сделать мужскую модельную стрижку, детскую стрижку, модное окрашивание, долговременную укладку и химическую завивку волос. Стоимость мужской стрижки - от 300 рублей. У мастера маникюра вам смогут сделать красивый маникюр, придать ухоженный вид ногтям на ногах, нанести шеллак, сделать наращивание ногтей, разработать собственный дизайн ногтей. Стоимость маникюра — от 300 рублей.   Цены здесь средние по городу.   Парикмахерская находится рядом со станцией метро Планерная, по адресу Химки, Калинина, 9. Часы работы с ежедневно: 10:00 - 21:00.     ",salon-alana.ru/
57a9caee40c088e74d8b7aa3,Мастерская красоты в Химках,beauty,False,37.436162,55.88389300000001,Планерная,Планерная,79645303065,0.0,0,0,"Химки, Горшина, 10",ежедневно: 10:00 - 20:00,"       В шумной городской суете иногда нужно баловать себя приятными услугами. Посетив мастерская красоты в Химках, вы сможете с пользой для себя провести время. Салон предлагает самые популярные услуги от мастеров с большим стажем работы.  В профессии парикмахера главное — овладение основным перечнем предоставляемых услуг. В мастерской красоты в Химках работают специалисты, которые выполнят все виды стрижек на должном уровне.  Мастерская красоты находится рядом со станцией метро Планерная, по адресу Химки, Горшина, 10. График работы: ежедневно: 10:00 - 20:00.     ",-
55d6a93fd8387f23268b456c,Детский массаж,beauty,False,37.4333333,55.8833333,Планерная,Планерная,79671583043,0.0,0,0,"Московская область, Химки",по записи,"       В бесконечной суете иногда нужно выделять время только для себя. Посетив детский массаж, вы сможете приятно и с пользой провести время. Для вас представлены самые востребованные услуги от мастеров с большим опытом.  Снять напряжение после тяжелого дня вам поможет расслабляющий массаж.  Детский массаж располагается рядом со станцией метро Планерная, по адресу Московская область, Химки. Режим работы: по записи.     ",massazh-khimki.narod.ru/
57a9ca6f40c088e74d8b6e35,Салон красоты Атмосфера на метро Планерная,beauty,False,37.401216999999995,55.866682,Планерная,Планерная,79262139442,0.0,0,0,"Москва,  МКАД 69 км,  к9, 1 этаж",пн-пт: 09:00—20:00,"       В салоне красоты Атмосфера всегда найдут, чем побаловать своих посетителей. В салоне вас ждет большой выбор услуг для красоты волос и тела. Опытные косметологи помогут вам вновь засветиться от счастья.   У мастера маникюра вам смогут сделать красивый маникюр.     Салон красоты находится рядом со станцией метро Планерная, по адресу МКАД 69 км, к9. Часы работы с пн-пт: 09:00 - 20:00.     ",-
57a9ca4540c088e74d8b690a,Парикмахерская Твоя парикмахерская,beauty,False,37.454926,55.892495,Планерная,Планерная,79015177064,0.0,0,0,"Химки,  Железнодорожная,  18",ежедневно: 08:00 - 20:00,"       Парикмахерская Твоя парикмахерская радует своих посетителей красивыми и оригинальными стрижками от профессионалов своего дела. Здесь ваши волосы ждет настоящее преображение, ведь специализированный уход за локонами — это основная функция мастеров парикмахерской.   У мастера маникюра вам смогут сделать красивый маникюр.     Парикмахерская находится рядом со станцией метро Планерная, по адресу Химки, Железнодорожная, 18. Часы работы с ежедневно: 08:00 - 20:00.     ",-
57a9c9e240c088e74d8b5df1,Салон красоты в Химках,beauty,False,37.434948,55.884663,Планерная,Планерная,74959025082,0.0,0,0,"Химки, Горшина, 9 к1, 1 этаж",ежедневно: 09:00 - 21:00,"       В салоне красоты в Химках предоставляют первоклассное обслуживание для своих клиентов. В салоне вас ждет большой выбор услуг для здоровья волос и тела. Опытные косметологи помогут вам вновь засветиться от счастья.  В профессии парикмахера главное — овладение основным перечнем предоставляемых услуг. В салоне красоты в Химках работают специалисты, которые выполнят все виды стрижек на должном уровне.  Тем, кто стремится побаловать свои пальчики на руках и ногах, здесь предлагают классический маникюр.  Голливудский загар — мечта практически любой девушки. Добиться ровного тона кожи вам поможет покупка абонемента в солярий. В сфере красоты подобные процедуры уже давно стали самыми востребованными среди женской части посетительниц.  Салон красоты находится рядом со станцией метро Планерная, по адресу Химки, Горшина, 9 к1. График работы: ежедневно: 09:00 - 21:00.     ",-
58e18ad540c0886f708bb2eb,Салон красоты Good_nail_hair,beauty,False,37.421391,55.878703,Планерная,Планерная,79859659211,0.0,0,0,"Химки,  Молодёжная,  1",ежедневно: 09:00 - 18:00,"       В салоне красоты Good_nail_hair всегда найдут, чем побаловать своих клиентов. Здесь вас ждет большой выбор процедур для красоты волос и тела. Мастера помогут вам снова засиять от счастья.   В кабинете маникюра вам смогут сделать маникюр.     Салон красоты располагается по адресу Химки, Молодёжная, 1. Часы работы с ежедневно: 09:00 - 18:00.     ",-
57a9cb7840c088e74d8b8b59,Салон красоты Руки Ножницы,beauty,False,37.433552,55.884455,Планерная,Планерная,79688805999,0.0,0,0,"Химки, Горшина, 8",ежедневно: 09:00 - 20:00,"       В салоне красоты Руки Ножницы всегда найдут, чем побаловать своих посетителей. Здесь вас ждет большой выбор процедур для сохранения красоты волос и тела. Мастера помогут вам снова засиять от счастья.   В кабинете маникюра вам смогут сделать маникюр.     Салон красоты располагается рядом со станцией метро Планерная, по адресу Химки, Горшина, 8. Часы работы с ежедневно: 09:00 - 20:00.     ",-
57a9ca4540c088e74d8b6916,"Парикмахерская на улице Кирова, 10 к 1 в Химках",beauty,False,37.451412,55.891999,Планерная,Планерная,79038407582,0.0,0,0,"Химки,  Кирова,  10 к1, 107 офис; 1 этаж",пн-сб: 09:00—20:00; вс: 09:00—18:00,"       Парикмахерская на улице Кирова, 10 к 1 в Химках удивляет своих посетителей красивыми и геометричными стрижками от профессионалов своего дела. Здесь вас ждет чудесное преображение, ведь профессиональный уход за локонами — это основная задача мастеров парикмахерской.  Работа парикмахера предполагает овладение основным перечнем возможных услуг. В парикмахерской на улице Кирова, 10 к 1 в Химках весь штат сотрудников — это специалисты, способные выполнить все виды стрижек на должном уровне.  Парикмахерская располагается рядом со станцией метро Планерная, по адресу Химки, Кирова, 10 к1. Режим работы: пн-сб: 09:00 - 20:00; вс: 09:00 - 18:00.     ",-
58e18ae240c0886f708bb347,Ногтевая студия NailStyle,beauty,False,37.434074,55.885358999999994,Планерная,Планерная,79661258636,0.0,0,0,"Химки, Горшина, 6 к2",ежедневно: 10:00 - 21:00,"       В бесконечной суете иногда нужно выделять время только для себя. Посетив ногтевую студию NailStyle, вы сможете приятно и с пользой провести время. Для вас представлены самые востребованные услуги от мастеров с большим опытом.   В кабинете маникюра вам смогут сделать маникюр.     Ногтевая студия располагается по адресу Химки, Горшина, 6 к2. Часы работы с ежедневно: 10:00 - 21:00.     ",-
54b35951b9556d740d8b458b,Real Steel Tattoo,beauty,False,37.439801,55.888141000000005,Планерная,Планерная,79250550493,0.0,0,0,"Московская область,  Химки,  Ленинградская улица,  10",по записи,"       В шумной городской суете иногда нужно баловать себя приятными услугами. Посетив real Steel Tattoo, вы сможете с пользой для себя провести время. Салон предлагает самые популярные услуги от мастеров с большим стажем работы.   А если вы хотите нанести на тело тату, сделать пирсинг, визажисты и стилисты всегда готовы помочь вам в создании образа.     находится рядом со станцией метро Планерная, по адресу Московская область, Химки, Ленинградская улица, 10. Часы работы с по записи.     ",Вконтакте
58e18a0540c0886f708bae91,Салон красоты Империя на Новотушинской улице,beauty,False,37.402924,55.871897,Планерная,Планерная,79685066826,0.0,0,0,"Путилково,  Новотушинская,  5, 1 этаж",ежедневно: 10:00 - 21:00,"       В салоне красоты Империя всегда найдут, чем побаловать своих гостей. Здесь вас ждет большой выбор процедур для сохранения красоты волос и тела. Мастера помогут вам снова засиять от счастья.   В кабинете маникюра вам смогут сделать маникюр. У косметолога вы сможете расслабиться на сеансе массажа.     Салон красоты располагается рядом со станцией метро Планерная, по адресу Путилково, Новотушинская, 5. Часы работы с ежедневно: 10:00 - 21:00.     ",Вконтакте
57a9ca4040c088e74d8b687d,Салон красоты Лика в Химках,beauty,False,37.427004,55.884523,Планерная,Планерная,79150301885,0.0,0,0,"Химки (Московская обл.),  Панфилова,  4",ежедневно: 10:00 - 21:00,"       В салоне красоты Лика всегда найдут, чем побаловать своих гостей. Здесь вас ждет большой выбор процедур для красоты волос и тела. Мастера помогут вам снова засиять от счастья.   В кабинете маникюра вам смогут сделать маникюр.     Салон красоты располагается рядом со станцией метро Планерная, по адресу Химки (Московская обл.), Панфилова, 4. Часы работы с ежедневно: 10:00 - 21:00.     ",-
572b0ee0493a411d028b4568,Салон красоты - парикмахерская,beauty,False,37.453091,55.896151,Планерная,Планерная,79168220560,0.0,0,0,"Московская область,  Химки,  Ленинский проспект,  1к3",по предварительной записи,"       В шумной городской суете иногда нужно баловать себя приятными услугами. Посетив салон красоты — парикмахерская, вы сможете с пользой для себя провести время. Салон предлагает самые популярные услуги от мастеров с большим стажем работы.  В профессии парикмахера главное — овладение основным перечнем предоставляемых услуг. В салон красоты — парикмахерская работают специалисты, которые выполнят все виды стрижек, укладку и окрашивание на должном уровне.  Салон красоты — парикмахерская находится рядом со станцией метро Планерная, по адресу Московская область, Химки, Ленинский проспект, 1к3. График работы: по предварительной записи.     ",-
57a9ca4740c088e74d8b693c,Ногтевая студия New nails,beauty,False,37.433336,55.888470999999996,Планерная,Планерная,79250907090,0.0,0,0,"Химки,  Ленинградское шоссе,  вл5, 2 этаж",ежедневно: 10:00 - 22:00,"       В бесконечной суете иногда нужно выделять время только для себя. Посетив ногтевую студию New nails, вы сможете с пользой для себя провести время. Салон предлагает самые востребованные услуги от мастеров с большим стажем работы.   У мастера маникюра вам смогут сделать красивый маникюр.     Ногтевая студия находится рядом со станцией метро Планерная, по адресу Химки, Ленинградское шоссе, вл5. Часы работы с ежедневно: 10:00 - 22:00.     ",-
5578af4b40c08885048b4ede,Студия загара Оранж на метро Планерная,beauty,False,37.433336,55.888470999999996,Планерная,Планерная,74955183194,0.0,0,0,"Химки,  Ленинградское шоссе,  вл5, -1 этаж",ежедневно: 10:00 - 22:00,"       В шумной городской суете иногда нужно баловать себя приятными услугами. Посетив студию загара Оранж, вы сможете с пользой для себя провести время. Салон предлагает самые популярные услуги от мастеров с большим стажем работы.   У косметолога вы сможете приобрести бронзовый голливудский загар.     Студия загара находится рядом со станцией метро Планерная, по адресу Химки, Ленинградское шоссе, вл5. Часы работы с ежедневно: 10:00 - 22:00.     ",www.orangestudio.ru
58e18aca40c0886f708bb265,Салон красоты Элизабет,beauty,False,37.448834999999995,55.895261,Планерная,Планерная,79261515944,0.0,0,0,"Химки,  Железнодорожная,  1 ст3",пн-пт: 10:00—21:00; сб-вс: 10:00—20:00,"       В салоне красоты Элизабет смогут порадовать своих посетителей. Здесь вас ждет большой выбор процедур для сохранения красоты волос и тела. Мастера помогут вам снова засиять от счастья.   В кабинете маникюра вам смогут сделать маникюр.     Салон красоты располагается рядом со станцией метро Планерная, по адресу Химки, Железнодорожная, 1 ст3. Часы работы с пн-пт: 10:00 - 21:00; сб-вс: 10:00 - 20:00.     ",-
58e18ac440c0886f708bb21b,Салон красоты на метро Планерная,beauty,False,37.428383000000004,55.8887,Планерная,Планерная,79055351002,0.0,0,0,"Химки,  Юбилейный проспект,  6а, 3 этаж",ежедневно: 09:00 - 21:00,"       В салоне красоты на метро Планерная смогут порадовать своих клиентов. В салоне вас ждет большой выбор услуг для красоты волос и тела. Опытные косметологи помогут вам вновь засветиться от счастья.   У мастера маникюра вам смогут сделать красивый маникюр.     Салон красоты находится рядом со станцией метро Планерная, по адресу Химки, Юбилейный проспект, 6а. Часы работы с ежедневно: 09:00 - 21:00.     ",Вконтакте
