ID,title,types,premium,lon,lat,metro_cat,metro,tel,rating,ratingCount,reviewCount,address,timing,description,site
584a538902edfe3f5e8b456a,Салон красоты Авиньон на Молодёжной улице в Химках,beauty,False,37.400935,55.899280000000005,Планерная,Планерная,79779705848,5.0,1,1,"Московская область,  Химки,  Молодёжная улица,  50",-,"       В салоне красоты Авиньон (рейтинг на Zoon — 5) смогут порадовать своих посетителей. В салоне вас ждет большой выбор процедур для здоровья волос и тела. Опытные косметологи помогут вам снова засветиться от счастья.   У мастера маникюра вам смогут сделать красивый маникюр.     Салон красоты находится рядом со станцией метро Планерная, по адресу Московская область, Химки, Молодёжная улица, 50.     ",Вконтакте
5232afea40c088ca5d8b4595,Студия маникюра Vivi,beauty,False,37.449923999999996,55.894245,Планерная,Планерная,79104253834,3.3,8,0,"Химки,  Московская,  14а, 2 этаж",ежедневно: 10:00 - 21:00,"      Мастера студии маникюра «Vivi» сотворят настоящее волшебство с вашими ноготками! Они приведут их в порядок, придадут правильную форму, удалят кутикулу и предложат защитное или яркое покрытие по вашему выбору. Стоит заметить, что цены в студии весьма умерены, что, безусловно, порадует каждого клиента.    ",-
510224bca0f3020735000009,Детская парикмахерская Чик-чик на метро Планерная,beauty,False,37.44944,55.881181000000005,Планерная,Планерная,74957263160,2.5,2,0,"Москва,  Правобережная,  1Б, 2 этаж",ежедневно: 09:00 - 22:00,"      «Чик-чик» — это сеть необычных детских парикмахерских, где даже самый активный малыш сможет спокойно перенести процесс стрижки. В салонах парикмахерских расположены игрушечные кресла-машинки, в которых ребята смогут почувствовать себя отважными гонщиками, пока мастера салона колдуют над прической. Также здесь богатый выбор мультфильмов и видео-игр, которые скрасят время, проведенное в парикмахерской, и отвлекут внимание вашего малыша. Визитная карточка салонов «Чик-чик» — это опытный, внимательный и терпеливый персонал; доступные цены и необыкновенная атмосфера веселья и радости.    ",www.tchiktchik.ru
5153a748a0f302df7e00000a,Салон-парикмахерская Авара,beauty,False,37.410323999999996,55.850865,"Планерная,Сходненская",Сходненская,74959489289,3.2,10,3,"Москва,  Яна Райниса бульвар,  30, цокольный этаж",пн-пт: 10:00—21:00; сб: 10:00—20:00; вс: 11:00—19:00,"      Салон-парикмахерская «Авара», который расположен в доме быта, предлагает услуги мастеров-универсалов парикмахерского зала и услуги студии загара. Персонал в салоне отличается от других высоким уровнем мастерства, вежливым отношением и внимательностью к каждому клиенту. Посетив новую студию загара, вы приобретете красивый бронзовый загар и ваша кожа будет излучать здоровье.    ",-
57a9caec40c088e74d8b7a5e,Салон красоты Васко да Гама,beauty,False,37.457314000000004,55.887259,Планерная,Планерная,74955324374,5.0,3,2,"Химки,  Ватутина,  4 к2",ежедневно: 10:00 - 22:00,"       В салоне красоты Васко да Гама (рейтинг на Zoon — 5) смогут порадовать своих гостей. В салоне вас ждет большой выбор услуг для красоты волос и тела. Опытные косметологи помогут вам вновь засветиться от счастья.   У мастера маникюра вам смогут сделать красивый маникюр.     Салон красоты находится рядом со станцией метро Планерная, по адресу Химки, Ватутина, 4 к2. Часы работы с ежедневно: 10:00 - 22:00.     ",васкодагама.рф
52c022d340c0886b7c8bd89b,Салон красоты Валерия-М на метро Планерная,beauty,False,37.424512,55.858791000000004,Планерная,Планерная,74954957031,2.5,13,4,"Москва,  улица Героев Панфиловцев,  16к1, цокольный этаж",ежедневно: 10:00 - 21:00,"      Салон красоты «Валерия-М» на улице Героев Панфиловцев расположен недалеко от станции метро Планерная. Здесь вас ожидает широкий спектр услуг в сфере парикмахерского искусства и ногтевого сервиса. Мастера салона выслушают все ваши просьбы и пожелания, создадут новый образ и дадут консультацию по уходу за своей внешностью в домашних условиях. Также вы можете посетить кабинет врача-косметолога, после очной консультации он назначит вам необходимое лечение и вернет вашей коже здоровый вид.Ведется предварительная запись по телефону.    ",-
57ccf471fcc8af2d5f8b4569,Массажный кабинет Массаж Мне на Ленинском проспекте в Химках,beauty,False,37.452309,55.895419,Планерная,Планерная,79261060913,3.0,1,0,"Московская область,  Химки,  Ленинский проспект,  1к1",по предварительной записи,"       В шумной городской суете иногда нужно баловать себя приятными услугами. Посетив массажный кабинет Массаж Мне (рейтинг на Zoon — 3), вы сможете с пользой для себя провести время. Для вас представлены самые популярные услуги от мастеров с большим опытом.  В профессии парикмахера главное — овладение основным перечнем возможных услуг. В массажном кабинете Массаж Мне работают специалисты, способные выполнить тонизирующий массаж головы на должном уровне.  Снять напряжение после долгого дня вам поможет расслабляющий или антицеллюлитный массаж.  Массажный кабинет располагается рядом со станцией метро Планерная, по адресу Московская область, Химки, Ленинский проспект, 1к1. График работы: по предварительной записи.     ",www.massaj.me
51dce225a0f302636c00003a,Салон красоты Клара на Ленинском проспекте в Химках,beauty,False,37.452696,55.895208,Планерная,Планерная,79252093540,1.9,14,4,"Химки,  Ленинский проспект,  1, 2 этаж",ежедневно: 09:00 - 21:00,"      Салон-парикмахерская «У Клары» находится на пересечении улицы Гоголя и Ленинского проспекта, рядом с парком имени Льва Толстого. Здесь вы сможете воспользоваться услугами парикмахеров, профессионального косметолога, а также мастера маникюра и педикюра — и все это по самым доступным ценам. В салоне-парикмахерской «У Клары» открыт массажный кабинет и солярий.    ",-
51e4f54da0f302f63b000015,Салон Эго в Куркино,beauty,False,37.392654,55.88946,Планерная,Планерная,74957417182,2.9,30,9,"Москва,  Воротынская,  14, 1 этаж",ежедневно: 09:00 - 21:00,"      Посетите салон красоты «Эго» на улице Воротынской и оцените не только высокое качество предоставляемых услуг, но и демократичные цены. Если вы все еще не можете определиться с выбором повседневного или праздничного образа — просто запишитесь к специалистам салона. Парикмахеры сотворят волшебство с вашими волосами, мастера ногтевой студии позаботятся о красоте ваших ноготков, а косметолог поможет избавиться от мелких недостатков вашей внешности. Также работает солярий.    ",-
52c023c340c0886b7c8be862,Центр бытовых услуг Камелия+ на Планерной улице,beauty,False,37.432852000000004,55.860122,Планерная,Планерная,74959980738,3.0,7,0,"Москва,  Планерная,  3 к1",пн-пт: 10:00—21:00; сб-вс: 10:00—18:00,"      Центр бытовых услуг «Камелия+» на Планерной улице приглашает вас воспользоваться услугами своего парикмахерского зала, где внимательные мастера помогут подобрать вам подходящую прическу, форму челочки и стрижку. Здесь же вы сможете отремонтировать одежду и сделать фото на документы.    ",-
57a9cae340c088e74d8b7970,Салон-парикмахерская Madame,beauty,False,37.442134,55.889621,Планерная,Планерная,79684668889,3.7,3,1,"Химки,  Московская,  32а",ежедневно: 10:00 - 21:00,"       В бесконечной суете иногда нужно выделять время только для себя. Посетив салон-парикмахерскую Madame (рейтинг на Zoon — 5), вы сможете приятно и с пользой провести время. Для вас представлены самые востребованные услуги от мастеров с большим опытом.   В кабинете маникюра вам смогут сделать маникюр.     Салон-парикмахерская располагается рядом со станцией метро Планерная, по адресу Химки, Московская, 32а. Часы работы с ежедневно: 10:00 - 21:00.     ",-
520c33c4a0f3022675000037,Ногтевая студия Милена на Соколово-Мещерской,beauty,False,37.389047,55.896367000000005,Планерная,Планерная,79164358385,2.5,11,0,"Москва,  Соколово-Мещерская улица,  14, 1 этаж, 10 кабинет",ежедневно: 10:00 - 21:00,"      Ногтевая студия на Соколово-Мещерской предлагает вам полный комплекс услуг по уходу за руками и ногами. Опытные мастера владеют различными видами маникюра и педикюра, включая спа-процедуры и экспресс-уход. Кроме того, в студии можно сделать моделирование искусственных ногтей. укрепить биогелем ногтевую пластину, а также выбрать из огромного ассортимента актуальных покрытий и техник дизайна.    ",-
55e7ae089da450ea478b4568,Салон красоты Nailcocktail,beauty,False,37.429927,55.887896,Планерная,Планерная,79267773957,1.0,1,1,"Химки, Горшина, 1",ежедневно: 09:00 - 21:00по предварительной записи,"       В салоне красоты Nailcocktail смогут порадовать своих гостей. В салоне вас ждет большой выбор услуг для красоты волос и тела. Опытные косметологи помогут вам вновь засветиться от счастья.   У мастера маникюра вам смогут сделать красивый маникюр, придать ухоженный вид ногтям на ногах, вернуть округлую форму вашим ногтям, выполнить аппаратный педикюр, нанести шеллак, сделать наращивание ногтей, сделать гелевые ноготки, разработать собственный дизайн ногтей. Стоимость маникюра — от 250 рублей. А если вы хотите записаться к мастеру наращивания ресниц, главные специалисты по красоте всегда готовы помочь вам в создании образа.   Цены здесь умеренные.   Салон красоты находится рядом со станцией метро Планерная, по адресу Химки, Горшина, 1. Часы работы с ежедневно: 09:00 - 21:00; по предварительной записи.     ",nail-cocktail.com/
57a9c9f240c088e74d8b5fee,Салон красоты Amore в Химках,beauty,False,37.413053999999995,55.897402,Планерная,Планерная,79639229932,5.0,1,0,"Химки,  Юбилейный проспект,  82а, цокольный этаж",пн-пт: 10:00—21:00; сб-вс: 10:00—20:00,"       В салоне красоты Amore смогут порадовать своих гостей. В салоне вас ждет большой выбор услуг для сохранения красоты волос и тела. Опытные косметологи помогут вам вновь засветиться от счастья.   У мастера маникюра вам смогут сделать красивый маникюр. У косметолога вы сможете приобрести бронзовый голливудский загар.     Салон красоты находится рядом со станцией метро Планерная, по адресу Химки, Юбилейный проспект, 82а. Часы работы с пн-пт: 10:00 - 21:00; сб-вс: 10:00 - 20:00.     ",jm-amore.ru
52c025c340c0886b7c8c0d91,Парикмахерская Венера,beauty,False,37.389047,55.896367000000005,Планерная,Планерная,79096408386,2.5,10,0,"Москва,  Соколово-Мещерская,  14, 9 кабинет; 1 этаж",ежедневно: 10:00 - 21:00,"      Сделать современную стрижку, а также поменять цвет волос вы сможете в парикмахерской «Венера», которая находится на Соколово-Мещерской улице. Опытные мастера парикмахерского дела найдут подход к каждому клиенту и помогут создать неповторимый образ, учитывая все ваши пожелания.    ",-
52c0227940c0886b7c8bd26b,Салон красоты Имидж на улице Героев Панфиловцев,beauty,False,37.410381,55.854576,"Планерная,Сходненская",Планерная,74957722037,3.0,6,2,"Москва,  улица Героев Панфиловцев,  41к1, 1 этаж",ежедневно: 09:00 - 21:00,      Парикмахерская «Имидж» на улице Героев Панфиловцев приглашает вас позаботиться о внешности: обновить стрижку и поухаживать за волосами с помощью опытных мастеров.    ,-
57a9cae040c088e74d8b7916,Студия маникюра Crystal,beauty,False,37.397921000000004,55.896533999999996,Планерная,Планерная,79032600751,4.0,4,1,"Москва,  Соловьиная Роща,  16",ежедневно: 10:00 - 21:00,"       В шумной городской суете иногда нужно баловать себя приятными услугами. Посетив студию маникюра Crystal (рейтинг на Zoon - 3.7), вы сможете с пользой для себя провести время. Салон предлагает самые популярные услуги от мастеров с большим стажем работы.   У мастера маникюра вам смогут сделать красивый маникюр.     Студия маникюра находится рядом со станцией метро Планерная, по адресу Соловьиная Роща, 16. Часы работы с ежедневно: 10:00 - 21:00.     ",-
51592346a0f302854c000005,Центр красоты Катюша на Фомичёвой улице ,beauty,False,37.437773,55.858647,"Планерная,Сходненская",Планерная,74994935306,2.6,18,9,"Москва,  улица Фомичевой,  16к5",ежедневно: 10:00 - 20:00,"      Вы можете смело довериться профессионалам салона красоты «Катюша». С помощью безупречной техники и последних достижений в индустрии красоты, они помогут вам обрести неотразимый, ослепительный облик, в котором идеальна каждая деталь, от безупречной прически до маникюра.    ",-
57d9fe5fec9fb0f4378b4588,Салон красоты Натали на метро Планерная,beauty,False,37.438266,55.852090000000004,"Планерная,Сходненская",Сходненская,74959440510,5.0,1,0,"Москва, улица Героев-Панфиловцев, 1/2",ежедневно: 09:00 - 21:00,"       В салоне красоты Натали смогут порадовать своих гостей. В салоне вас ждет большой выбор услуг для сохранения красоты волос и тела. Опытные косметологи помогут вам вновь засветиться от счастья.   У мастера маникюра вам смогут сделать красивый маникюр.     Салон красоты находится рядом со станцией метро Сходненская, по адресу улица Героев-Панфиловцев, 1/2. Часы работы с ежедневно: 09:00 - 21:00.     ",-
5680d66dd1a1d8fc108b4570,"Парикмахерская на Фомичёвой улице , 8",beauty,False,37.444665,55.858098999999996,"Планерная,Сходненская",Планерная,74994972878,2.8,6,2,"Москва,  улица Фомичёвой,  8",пн-сб: 09:00—21:00; вс: 10:00—20:00,"       Парикмахерская на Фомичёвой улице, 8 (рейтинг на Zoon - 2.8) радует своих посетителей красивыми и аккуратными стрижками от настоящих профи. Здесь ваши волосы ждет чудесное преображение, ведь специализированный уход за локонами — это основная задача мастеров парикмахерской.  Работа парикмахера предполагает овладение основным перечнем предоставляемых услуг. В парикмахерской на Фомичёвой улице, 8 весь штат сотрудников — это специалисты, которые выполнят мужские и женские стрижки, укладку и свадебную прическу на должном уровне. Стоимость стрижки для мужчин - от 300 рублей. В этом салоне-парикмахерской работают не только со взрослыми, но и с самыми юными клиентами. Мастера умеют найти подход к деткам так, чтобы стрижка принесла радость.  Если вас интересует стоимость процедур, то уровень цен в салоне средний.  Парикмахерская располагается рядом со станцией метро Планерная, по адресу улица Фомичёвой, 8. График работы: пн-сб: 09:00 - 21:00; вс: 10:00 - 20:00.     ",-
57a9caed40c088e74d8b7a97,Салон-парикмахерская Самая Самая,beauty,False,37.42476,55.885379,Планерная,Планерная,-,5.0,1,1,"Химки,  Юбилейный проспект,  1 к2",ежедневно: 09:00 - 21:00,"       В шумной городской суете иногда нужно баловать себя приятными услугами. Посетив салон-парикмахерскую Самая Самая (рейтинг на Zoon — 5), вы сможете с пользой для себя провести время. Салон предлагает самые популярные услуги от мастеров с большим стажем работы.   А если вы хотите нанести легкий макияж, главные специалисты по красоте всегда готовы помочь вам в создании образа.     Салон-парикмахерская находится рядом со станцией метро Планерная, по адресу Химки, Юбилейный проспект, 1 к2. Часы работы с ежедневно: 09:00 - 21:00.     ",prkm1.ru
51e76723a0f3022a41000015,Парикмахерская Юно на метро Планерная,beauty,False,37.434809,55.89213,Планерная,Планерная,74955726543,5.0,3,1,"Химки,  Ленинградская,  19, 1 этаж",ежедневно: 09:00 - 20:00,"      Салон-парикмахерская «Экономь» — это уютное заведение, пропитанное домашней атмосферой, где вы сможете найти популярные и качественные услуги мастеров ногтевого сервиса и парикмахеров-универсалов. Вы приятно удивитесь не только широким выбором различных процедур, которые преобразят вашу внешность, но и умеренным ценам.Салон открыт с девяти утра до восьми вечера, без обеда и выходных.    ",-
